<?xml version="1.0"?>
<!DOCTYPE courses SYSTEM "timetable.dtd">
<courses>
    <course name="comp4985">
        <booking>
            <day>monday</day>
            <time>0930</time>
            <room>se12 323</room>
            <type>lab</type>
            <instructor>aman abdulla</instructor>
        </booking>
        <booking>
            <day>monday</day>
            <time>1030</time>
            <room>se12 323</room>
            <type>lab</type>
            <instructor>aman abdulla</instructor>
        </booking>
        <booking>
            <day>wednesday</day>
            <time>0930</time>
            <room>se12 323</room>
            <type>lecture</type>
            <instructor>aman abdulla</instructor>
        </booking>
        <booking>
            <day>wednesday</day>
            <time>1030</time>
            <room>se12 323</room>
            <type>lecture</type>
            <instructor>aman abdulla</instructor>
        </booking>
        <booking>
            <day>wednesday</day>
            <time>1130</time>
            <room>se12 323</room>
            <type>lecture</type>
            <instructor>aman abdulla</instructor>
        </booking>
    </course>
    <course name="comp4981">
        <booking>
            <day>tuesday</day>
            <time>0930</time>
            <room>se12 323</room>
            <type>lab</type>
            <instructor>aman abdulla</instructor>
        </booking>
        <booking>
            <day>tuesday</day>
            <time>1030</time>
            <room>se12 323</room>
            <type>lab</type>
            <instructor>aman abdulla</instructor>
        </booking>
        <booking>
            <day>wednesday</day>
            <time>1230</time>
            <room>se12 323</room>
            <type>lecture</type>
            <instructor>aman abdulla</instructor>
        </booking>
        <booking>
            <day>thursday</day>
            <time>0930</time>
            <room>se12 323</room>
            <type>lecture</type>
            <instructor>aman abdulla</instructor>
        </booking>
        <booking>
            <day>thursday</day>
            <time>1030</time>
            <room>se12 323</room>
            <type>lecture</type>
            <instructor>aman abdulla</instructor>
        </booking>
    </course>
    <course name="comp4735">
        <booking>
            <day>monday</day>
            <time>1130</time>
            <room>sw1 1205</room>
            <type>lecture</type>
            <instructor>mirela gutica</instructor>
        </booking>
        <booking>
            <day>wednesday</day>
            <time>1330</time>
            <room>sw1 1205</room>
            <type>lecture</type>
            <instructor>mirela gutica</instructor>
        </booking>
        <booking>
            <day>thursday</day>
            <time>1130</time>
            <room>sw3 1710</room>
            <type>lecture</type>
            <instructor>mirela gutica</instructor>
        </booking>
        <booking>
            <day>thursday</day>
            <time>1530</time>
            <room>se12 322</room>
            <type>lab</type>
            <instructor>mathew linder</instructor>
        </booking>
        <booking>
            <day>thursday</day>
            <time>1630</time>
            <room>se12 322</room>
            <type>lab</type>
            <instructor>mathew linder</instructor>
        </booking>
    </course>
    <course name="blaw3600">
        <booking>
            <day>monday</day>
            <time>1230</time>
            <room>sw9 127</room>
            <type>lab</type>
            <instructor>catherine ryan</instructor>
        </booking>
        <booking>
            <day>monday</day>
            <time>1330</time>
            <room>sw9 127</room>
            <type>lab</type>
            <instructor>catherine ryan</instructor>
        </booking>
        <booking>
            <day>friday</day>
            <time>0830</time>
            <room>sw5 1840</room>
            <type>lecture</type>
            <instructor>catherine ryan</instructor>
        </booking>
        <booking>
            <day>friday</day>
            <time>0930</time>
            <room>sw5 1840</room>
            <type>lecture</type>
            <instructor>catherine ryan</instructor>
        </booking>
    </course>
    <course name="comp4560">
        <booking>
            <day>monday</day>
            <time>1530</time>
            <room>se12 320</room>
            <type>lab</type>
            <instructor>brenda fine</instructor>
        </booking>
        <booking>
            <day>monday</day>
            <time>1630</time>
            <room>se12 320</room>
            <type>lab</type>
            <instructor>brenda fine</instructor>
        </booking>
        <booking>
            <day>monday</day>
            <time>1130</time>
            <room>sw5 1850</room>
            <type>lecture</type>
            <instructor>brenda fine</instructor>
        </booking>
        <booking>
            <day>friday</day>
            <time>1230</time>
            <room>sw3 1750</room>
            <type>lecture</type>
            <instructor>brenda fine</instructor>
        </booking>
    </course>
    <course name="comp4711">
        <booking>
            <day>tuesday</day>
            <time>1430</time>
            <room>sw5 1840</room>
            <type>lecture</type>
            <instructor>james parry</instructor>
        </booking>
        <booking>
            <day>tuesday</day>
            <time>1530</time>
            <room>se12 321</room>
            <type>lab</type>
            <instructor>james parry</instructor>
        </booking>
        <booking>
            <day>tuesday</day>
            <time>1630</time>
            <room>se12 321</room>
            <type>lab</type>
            <instructor>james parry</instructor>
        </booking>
    </course>
</courses>
